{
  "type": "class",
  "name": "priest_brother_battle_upbringing",
  "folder": null,
  "system": {
    "slug": "priest_brother_battle_upbringing",
    "description": "",
    "characteristics": [
      [
        {
          "slug": "strength",
          "value": 1
        }
      ],
      [
        {
          "slug": "dexterity",
          "value": 1
        }
      ],
      [
        {
          "slug": "endurance",
          "value": 1
        }
      ],
      [
        {
          "slug": "will",
          "value": 1
        }
      ],
      [
        {
          "slug": "faith",
          "value": 1
        }
      ]
    ],
    "skills": [
      [
        {
          "slug": "academia",
          "value": 1
        }
      ],
      [
        {
          "slug": "fight",
          "value": 1
        }
      ],
      [
        {
          "slug": "focus",
          "value": 1
        }
      ],
      [
        {
          "slug": "vigor",
          "value": 2
        }
      ]
    ],
    "capabilities": [
      [
        "combat_armor",
        "war_armor"
      ],
      [
        "cathedral_customs"
      ],
      [
        "read_speak_urthish"
      ],
      [
        "religion_lore"
      ]
    ],
    "perk": "inspiring",
    "perks": [
      "martial_arts_graa",
      "martial_arts_iron_heel",
      "martial_arts_jox_kai_von",
      "martial_arts_koto",
      "martial_arts_shaidan",
      "shepherd_of_the_flock",
      "holier_than_thou",
      "chartophylax",
      "witch_hunt",
      "condemn",
      "enlightened",
      "invigorate",
      "purge",
      "wise_one",
      "harmonize",
      "hierophant",
      "legate",
      "nimble",
      "landed",
      "riches",
      "inquisitorial_seal",
      "righteous_sermon",
      "retainer",
      "petition",
      "church_ordination"
    ],
    "factions": [
      "brother_battle_faction",
      "eskatonic_order",
      "sanctuary_aeon",
      "temple_avesti",
      "urth_orthodox"
    ]
  },
  "img": "icons/skills/trades/academics-scribe-quill-gray.webp",
  "effects": [],
  "ownership": {
    "default": 0,
    "ef54fWvGiyPGgegN": 3
  },
  "flags": {},
  "_stats": {
    "compendiumSource": null,
    "duplicateSource": null,
    "exportSource": null,
    "coreVersion": "13.350",
    "systemId": "fading-suns-4",
    "systemVersion": "0.0.1",
    "createdTime": 1760795837654,
    "modifiedTime": 1760795837666,
    "lastModifiedBy": "ef54fWvGiyPGgegN"
  },
  "_id": "Xe7uOb71oNAyNnmU",
  "sort": 200000,
  "_key": "!items!Xe7uOb71oNAyNnmU"
}
